{
  "group_id": 0,
  "groupId": 0,
  "flat_pts": [
    { "x": 0.0, "y": 0.0},
    { "x": 3.0, "y": 0.0},
    { "x": 3.0, "y": 1.0},
    { "x": 1.5, "y": 1.0},
    { "x": 1.5, "y": 2.5},
    { "x": 0.0, "y": 2.5}
  ],
  "ring_counts": [6],
  "ring_roles": [0],
  "meta": {
    "joinType": 0,
    "miterLimit": 2.0,
    "unitScale": 1.0,
    "useDocUnit": true,
    "normalize": {
      "orientation": true,
      "start": true,
      "sortRings": true
    }
  }
}
